{
  "generated_at": "2026-07-10T23:27:19-03:00",
  "models": [
    {
      "id": "sonnet-5",
      "name": "Sonnet 5",
      "vendor": "Anthropic",
      "price_in": 2.0,
      "price_out": 10.0,
      "badge": "preço promocional até 31/08/2026 (depois $3/$15)"
    },
    {
      "id": "sonnet-4-6",
      "name": "Sonnet 4.6",
      "vendor": "Anthropic",
      "price_in": 3.0,
      "price_out": 15.0
    },
    {
      "id": "opus-4-8",
      "name": "Opus 4.8",
      "vendor": "Anthropic",
      "price_in": 5.0,
      "price_out": 25.0
    },
    {
      "id": "fable-5",
      "name": "Fable 5",
      "vendor": "Anthropic",
      "price_in": 10.0,
      "price_out": 50.0
    },
    {
      "id": "gpt-5-6-luna",
      "name": "GPT-5.6 Luna",
      "vendor": "OpenAI",
      "price_in": 1.0,
      "price_out": 6.0
    },
    {
      "id": "gpt-5-6-terra",
      "name": "GPT-5.6 Terra",
      "vendor": "OpenAI",
      "price_in": 2.5,
      "price_out": 15.0
    },
    {
      "id": "gpt-5-6-sol",
      "name": "GPT-5.6 Sol",
      "vendor": "OpenAI",
      "price_in": 5.0,
      "price_out": 30.0
    },
    {
      "id": "grok-4-5",
      "name": "Grok 4.5",
      "vendor": "xAI",
      "price_in": 2.0,
      "price_out": 6.0
    },
    {
      "id": "haiku-4-5",
      "name": "Haiku 4.5",
      "vendor": "Anthropic",
      "price_in": 1.0,
      "price_out": 5.0
    },
    {
      "id": "gpt-5-5",
      "name": "GPT-5.5",
      "vendor": "OpenAI",
      "price_in": 5.0,
      "price_out": 30.0
    },
    {
      "id": "gpt-5-4",
      "name": "GPT-5.4",
      "vendor": "OpenAI",
      "price_in": 2.5,
      "price_out": 15.0
    },
    {
      "id": "gpt-5-4-mini",
      "name": "GPT-5.4 Mini",
      "vendor": "OpenAI",
      "price_in": 0.75,
      "price_out": 4.5
    },
    {
      "id": "gpt-5-3-codex-spark",
      "name": "GPT-5.3 Codex Spark",
      "vendor": "OpenAI",
      "price_in": 1.75,
      "price_out": 14.0
    },
    {
      "id": "grok-composer-2-5-fast",
      "name": "Grok Composer 2.5 Fast",
      "vendor": "xAI",
      "price_in": 0.5,
      "price_out": 2.5
    },
    {
      "id": "glm-5-2",
      "name": "GLM 5.2",
      "vendor": "Zhipu",
      "price_in": 1.4,
      "price_out": 4.4
    },
    {
      "id": "glm-5-turbo",
      "name": "GLM 5 Turbo",
      "vendor": "Zhipu",
      "price_in": 1.2,
      "price_out": 4.0
    },
    {
      "id": "gemini-3-5-flash",
      "name": "Gemini 3.5 Flash",
      "vendor": "Google",
      "price_in": 1.5,
      "price_out": 9.0
    }
  ],
  "tests": [
    {
      "id": "001",
      "slug": "sistema-solar-3d",
      "activity": "Quero um app 3D interativo",
      "category": "3D interativo",
      "track": "benchmark",
      "prompt_ref": "prompts/001-sistema-solar-3d.md"
    },
    {
      "id": "002",
      "slug": "site-apple",
      "activity": "Clona esse site",
      "category": "clone de site",
      "track": "benchmark",
      "prompt_ref": "prompts/002-site-apple.md"
    },
    {
      "id": "003",
      "slug": "fisica-mouse",
      "activity": "Brinquedo de física",
      "category": "física/canvas",
      "track": "benchmark",
      "prompt_ref": "prompts/003-fisica-mouse.md"
    },
    {
      "id": "004",
      "slug": "fps",
      "activity": "Faz um jogo",
      "category": "jogo 3D",
      "track": "benchmark",
      "prompt_ref": "prompts/004-fps.md"
    },
    {
      "id": "101",
      "slug": "caca-bug",
      "activity": "Acha esse bug pra mim",
      "category": "debug",
      "track": "dia-a-dia",
      "prompt_ref": "prompts/101-caca-bug.md"
    },
    {
      "id": "103",
      "slug": "feature-alheia",
      "activity": "Adiciona um filtro no meu app",
      "category": "feature em código existente",
      "track": "dia-a-dia",
      "prompt_ref": "prompts/103-feature-alheia.md"
    },
    {
      "id": "104",
      "slug": "css-mobile",
      "activity": "Conserta o mobile sem mexer no desktop",
      "category": "CSS responsivo",
      "track": "dia-a-dia",
      "prompt_ref": "prompts/104-css-mobile.md"
    },
    {
      "id": "105",
      "slug": "revisar-codigo",
      "activity": "Revisa esse código antes de eu subir",
      "category": "code review",
      "track": "dia-a-dia",
      "prompt_ref": "prompts/105-revisar-codigo.md"
    },
    {
      "id": "108",
      "slug": "dado-sujo",
      "activity": "Gera um relatório desse CSV zoado",
      "category": "dados",
      "track": "dia-a-dia",
      "prompt_ref": "prompts/108-dado-sujo.md"
    }
  ],
  "results": [
    {
      "test": "001",
      "model": "sonnet-5",
      "run_ref": "runs/sonnet-5/001/index.html",
      "verdict": "defeitos",
      "acabamento_score": "1/1",
      "cost_usd": 0.250773,
      "tokens_out": 7953,
      "rounds": 5,
      "duration_s": 78.0,
      "verified_in_browser": null,
      "judge_ref": "judging/001/run-O.judge.json",
      "source": "measured"
    },
    {
      "test": "001",
      "model": "sonnet-4-6",
      "run_ref": "runs/sonnet-4-6/001/index.html",
      "verdict": "entregou",
      "acabamento_score": "1/1",
      "cost_usd": 0.690021,
      "tokens_out": 38466,
      "rounds": 4,
      "duration_s": 551.0,
      "verified_in_browser": null,
      "judge_ref": "judging/001/run-C.judge.json",
      "source": "measured"
    },
    {
      "test": "001",
      "model": "opus-4-8",
      "run_ref": "runs/opus-4-8/001/index.html",
      "verdict": "defeitos",
      "acabamento_score": "1/1",
      "cost_usd": 0.482317,
      "tokens_out": 11452,
      "rounds": 4,
      "duration_s": 140.0,
      "verified_in_browser": null,
      "judge_ref": "judging/001/run-D.judge.json",
      "source": "measured"
    },
    {
      "test": "001",
      "model": "fable-5",
      "run_ref": "runs/fable-5/001/index.html",
      "verdict": "defeitos",
      "acabamento_score": "1/1",
      "cost_usd": 0.783737,
      "tokens_out": 9077,
      "rounds": 2,
      "duration_s": 107.0,
      "verified_in_browser": null,
      "judge_ref": "judging/001/run-F.judge.json",
      "source": "measured",
      "source_note": "Custo medido do re-run canônico de 09/jul (runs/fable-5/001/manifest.json). Substitui o $4,41 da v0, que media a 1ª geração de 01/jul (archive/runs-fable5-01jul) — são runs diferentes, os números não são comparáveis."
    },
    {
      "test": "001",
      "model": "gpt-5-6-luna",
      "run_ref": "runs/gpt-5-6-luna/001/index.html",
      "verdict": "entregou",
      "acabamento_score": "1/1",
      "cost_usd": 0.309267,
      "tokens_out": 34148,
      "rounds": 9,
      "duration_s": 631.5,
      "verified_in_browser": null,
      "judge_ref": "judging/001/run-G.judge.json",
      "source": "measured"
    },
    {
      "test": "001",
      "model": "gpt-5-6-terra",
      "run_ref": "runs/gpt-5-6-terra/001/index.html",
      "verdict": "entregou",
      "acabamento_score": "1/1",
      "cost_usd": 1.653984,
      "tokens_out": 34791,
      "rounds": 50,
      "duration_s": 1433.4,
      "verified_in_browser": null,
      "judge_ref": "judging/001/run-A.judge.json",
      "source": "measured"
    },
    {
      "test": "001",
      "model": "gpt-5-6-sol",
      "run_ref": "runs/gpt-5-6-sol/001/index.html",
      "verdict": "defeitos",
      "acabamento_score": "1/1",
      "cost_usd": 4.021531,
      "tokens_out": 42427,
      "rounds": 57,
      "duration_s": 1301.5,
      "verified_in_browser": null,
      "judge_ref": "judging/001/run-E.judge.json",
      "source": "measured"
    },
    {
      "test": "001",
      "model": "grok-4-5",
      "run_ref": "runs/grok-4-5/001/index.html",
      "verdict": "defeitos",
      "acabamento_score": "1/1",
      "cost_usd": 0.201536,
      "tokens_out": 14216,
      "rounds": 5,
      "duration_s": 95.3,
      "verified_in_browser": null,
      "judge_ref": "judging/001/run-K.judge.json",
      "source": "measured"
    },
    {
      "test": "001",
      "model": "haiku-4-5",
      "run_ref": "runs/haiku-4-5/001/index.html",
      "verdict": "defeitos",
      "acabamento_score": "1/1",
      "cost_usd": 0.059594,
      "tokens_out": 5271,
      "rounds": 3,
      "duration_s": 60.0,
      "verified_in_browser": null,
      "judge_ref": "judging/001/run-H.judge.json",
      "source": "measured"
    },
    {
      "test": "001",
      "model": "gpt-5-5",
      "run_ref": "runs/gpt-5-5/001/index.html",
      "verdict": "defeitos",
      "acabamento_score": "1/1",
      "cost_usd": 3.292604,
      "tokens_out": 40878,
      "rounds": 46,
      "duration_s": 1055.2,
      "verified_in_browser": null,
      "judge_ref": "judging/001/run-M.judge.json",
      "source": "measured"
    },
    {
      "test": "001",
      "model": "gpt-5-4",
      "run_ref": "runs/gpt-5-4/001/index.html",
      "verdict": "entregou",
      "acabamento_score": "1/1",
      "cost_usd": 0.978664,
      "tokens_out": 32047,
      "rounds": 23,
      "duration_s": 645.4,
      "verified_in_browser": null,
      "judge_ref": "judging/001/run-B.judge.json",
      "source": "measured"
    },
    {
      "test": "001",
      "model": "gpt-5-4-mini",
      "run_ref": "runs/gpt-5-4-mini/001/index.html",
      "verdict": "entregou",
      "acabamento_score": "1/1",
      "cost_usd": 0.380757,
      "tokens_out": 55483,
      "rounds": 15,
      "duration_s": 2064.0,
      "verified_in_browser": null,
      "judge_ref": "judging/001/run-J.judge.json",
      "source": "measured"
    },
    {
      "test": "001",
      "model": "gpt-5-3-codex-spark",
      "run_ref": "runs/gpt-5-3-codex-spark/001/index.html",
      "verdict": "quebrou",
      "acabamento_score": "0/1",
      "cost_usd": 0.197318,
      "tokens_out": 11942,
      "rounds": 2,
      "duration_s": 19.4,
      "verified_in_browser": null,
      "judge_ref": "judging/001/run-Q.judge.json",
      "source": "measured"
    },
    {
      "test": "001",
      "model": "grok-composer-2-5-fast",
      "run_ref": "runs/grok-composer-2-5-fast/001/index.html",